{
  "levels": [
    {
      "id": "lvl_01",
      "name": "1F",
      "elevation": 0,
      "height": 2800,
      "walls": [
        {
          "id": "w_01",
          "a": [0, 0],
          "b": [5000, 0],
          "thickness": 200,
          "type": "exterior"
        },
        {
          "id": "w_02",
          "a": [5000, 0],
          "b": [5000, 4000],
          "thickness": 200,
          "type": "exterior"
        },
        {
          "id": "w_03",
          "a": [5000, 4000],
          "b": [0, 4000],
          "thickness": 200,
          "type": "exterior"
        },
        {
          "id": "w_04",
          "a": [0, 4000],
          "b": [0, 0],
          "thickness": 200,
          "type": "exterior"
        }
      ],
      "openings": [
        {
          "id": "o_01",
          "wallId": "w_01",
          "type": "door",
          "offset": 800,
          "width": 900,
          "height": 2100,
          "sill": 0,
          "swing": "left"
        },
        {
          "id": "o_02",
          "wallId": "w_02",
          "type": "window",
          "offset": 1200,
          "width": 1800,
          "height": 1200,
          "sill": 900
        }
      ],
      "rooms": [
        {
          "id": "r_01",
          "label": "客廳",
          "wallIds": ["w_01", "w_02", "w_03", "w_04"]
        }
      ],
      "objects": [
        {
          "id": "obj_01",
          "catalogId": "sofa_3seat_generic_a",
          "position": [2500, 0, 3200],
          "rotationY": 3.14159,
          "scale": [1, 1, 1]
        }
      ]
    }
  ],
  "cameras": [
    {
      "id": "cam_01",
      "name": "客廳視角",
      "position": [500, 1600, 500],
      "target": [3000, 1000, 3000],
      "fovDeg": 60
    }
  ],
  "meta": {
    "source": "manual"
  },
  "schemaVersion": "1.3.0",
  "units": "mm"
}
